<?xml version="1.0" encoding="ISO-8859-1" standalone="no"?>
<!DOCTYPE Example SYSTEM "../DTD/Example.dtd">
<Example>
	<KnowledgeBase>
		<Title>Example PcodeVector isAtom 009</Title>
		<Template>Example</Template>
		<FunctionKeywords>isAtom</FunctionKeywords>
		<TypeKeywords>PcodeVector Boolean Pair List</TypeKeywords>
		<RelatedFunctions>isPair</RelatedFunctions>
		<Language>Lisp</Language>
		<HumanKeywords>atom pair list non-list</HumanKeywords>
	</KnowledgeBase>
	<Description><![CDATA[ These examples check whether the object evaluated is




                  a Pair or not.  




	]]></Description>
	<Syntax>
  	    <Expression><![CDATA[ <sc> (setq X (new Vector:  pcode: 5 4 ))    </sc>]]></Expression>  
        <Note><![CDATA[none ]]></Note> 
        <Returns><![CDATA[#&#60PcodeVector 123456&#62]]></Returns>
  	    <Expression><![CDATA[ <sc>(isAtom X )  </sc>]]></Expression>
        <Note><![CDATA[The evaluated object is a Vector, not a Pair, so true is returned. ]]></Note>
        <Returns><![CDATA[true]]></Returns>
        <Expression><![CDATA[ <sc>(isAtom  '(1  2))   </sc>]]></Expression>
        <Note><![CDATA[The evaluated object is a  Pair, so false is returned. ]]></Note>
        <Returns><![CDATA[false]]></Returns>
        <Hints><![CDATA[none ]]></Hints>
   </Syntax>
</Example>
