<?xml version="1.0" encoding="ISO-8859-1" standalone="no"?>
<!DOCTYPE Example SYSTEM "../DTD/Example.dtd">
<Example>
	<KnowledgeBase>
		<Title>Example Number asin 001</Title>
		<Template>Example</Template>
		<FunctionKeywords>asin</FunctionKeywords>
		<TypeKeywords>Number Integer</TypeKeywords>
		<RelatedFunctions> acos atan </RelatedFunctions>
		<Language>Lisp</Language>
		<HumanKeywords>arc sine</HumanKeywords>
	</KnowledgeBase>
	<Description><![CDATA[ These examples use the <b>asin</b> function to compute the arc sine
                  of the argument.

	]]></Description>
	<Syntax>
  	    <Expression><![CDATA[ <sc>(asin 0) </sc>]]></Expression>
        <Note><![CDATA[none ]]></Note>
        <Returns><![CDATA[0]]></Returns>
        <Expression><![CDATA[ <sc>(asin -1)</sc>]]></Expression>
        <Note><![CDATA[none ]]></Note>
        <Returns><![CDATA[-1.570796326795]]></Returns>
        <Expression><![CDATA[ <sc>(asin 1) </sc>]]></Expression>
        <Note><![CDATA[none ]]></Note>
        <Returns><![CDATA[1.570796326795]]></Returns>
        <Hints><![CDATA[none]]></Hints>
   </Syntax>
</Example>
