<?xml version="1.0" encoding="ISO-8859-1" standalone="no"?>
<!DOCTYPE Example SYSTEM "../DTD/Example.dtd">
<Example>
	<KnowledgeBase>
		<Title>Example Character ccompareGT 001</Title>
		<Template>Example</Template>
		<FunctionKeywords>ccompareGT</FunctionKeywords>
		<TypeKeywords>Integer Boolean Character</TypeKeywords>
		<RelatedFunctions> ccompareEQ ccompareNE ccompareGE ccompareLT  ccompareLE</RelatedFunctions>
		<Language>Lisp</Language>
		<HumanKeywords>compare Lambda greater character</HumanKeywords>
	</KnowledgeBase>
	<Description><![CDATA[ These examples use the <b>ccompareGT</b> function to compare two objects and return







                  the Boolean value, true if the first argument is greater than the second argument
                 or false if otherwise.  





	]]></Description>
	<Syntax>
  	    <Expression><![CDATA[ <sc>
(ccompareGT #\c #\d)         </sc>]]></Expression>
        <Note><![CDATA[none]]></Note>
        <Returns><![CDATA[false]]></Returns>
 	    <Expression><![CDATA[ <sc>
(ccompareGT #\f #\d)</sc>]]></Expression>
        <Note><![CDATA[none]]></Note>
        <Returns><![CDATA[true]]></Returns>
        <Expression><![CDATA[ <sc>(ccompareGT #\c #\c)  </sc>]]></Expression>
        <Note><![CDATA[none]]></Note>
        <Returns><![CDATA[false]]></Returns>
        <Hints><![CDATA[none]]></Hints>
   </Syntax>
</Example>
