<?xml version="1.0" encoding="ISO-8859-1" standalone="no"?>
<!DOCTYPE Example SYSTEM "../DTD/Example.dtd">
<Example>
	<KnowledgeBase>
		<Title>Example ByteVector isCharName 003</Title>
		<Template>Example</Template>
		<FunctionKeywords>isCharName</FunctionKeywords>
		<TypeKeywords>Text Character String Symbol ByteVector </TypeKeywords>
		<RelatedFunctions>isType isChar isCharAlphabetic isCharAlphanumeric



                          isCharLowercase isCharNumeric isCharUppercase isCharWhitespace



                          isString isText </RelatedFunctions>
		<Language>Lisp</Language>
		<HumanKeywords>Character Alphabetic Object Uppercase Lowercase Name



                       Underscore Numeric Alphanumeric Name Whitespace</HumanKeywords>
	</KnowledgeBase>
	<Description><![CDATA[ These examples check if the object is is made up of alphanumeric or underscore



                  characters. If it is,  the function returns true, otherwise, it returns false.



 



	]]></Description>
	<Syntax>
  	    <Expression><![CDATA[ <sc>(isCharName  #\p)  </sc>]]></Expression>
        <Note><![CDATA[none]]></Note>
        <Returns><![CDATA[true]]></Returns>
        <Expression><![CDATA[ <sc>(isCharName "My Name is Anna") </sc>]]></Expression>
        <Note><![CDATA[none ]]></Note>
        <Returns><![CDATA[ false ]]></Returns>
        <Expression><![CDATA[ <sc>(isCharName Ab_de:) </sc>]]></Expression>
        <Note><![CDATA[none ]]></Note>
        <Returns><![CDATA[ true ]]></Returns>
        <Expression><![CDATA[ <sc>(isCharName  abc:)</sc>]]></Expression>
        <Note><![CDATA[none ]]></Note>
        <Returns><![CDATA[ true ]]></Returns>
        <Expression><![CDATA[ <sc>(isCharName  #&#60Dictionary 47917&#62) </sc>]]></Expression>
        <Note><![CDATA[none ]]></Note>
        <Returns><![CDATA[ false ]]></Returns>
        <Hints><![CDATA[This function returns false if there are whitespaces between



               alphanumeric or underscore characters.]]></Hints>
   </Syntax>
</Example>
