<?xml version="1.0" encoding="ISO-8859-1" standalone="no"?>
<!DOCTYPE Example SYSTEM "../DTD/Example.dtd">
<Example>
	<KnowledgeBase>
		<Title>Example NumMatrix append 012</Title>
		<Template>Example</Template>
		<FunctionKeywords>append</FunctionKeywords>
		<TypeKeywords>NumMatrix</TypeKeywords>
		<RelatedFunctions>new replace rept</RelatedFunctions>
		<Language>Lisp</Language>
		<HumanKeywords>append concatenate  matrix </HumanKeywords>
	</KnowledgeBase>
	<Description><![CDATA[ This example takes an existing Number Matrix and appends a new number values.

	]]></Description>
	<Syntax>
  	    <Expression><![CDATA[ <sc>(define X #(nummat| 3 5 3 2 1 ) )      </sc>]]></Expression>
        <Note><![CDATA[none ]]></Note>
        <Returns><![CDATA[#&#60NumMatrix 123456&#62 ]]></Returns>
        <Expression><![CDATA[ <sc>(define Y #(nummat| 12 14 15 ) )       </sc>]]></Expression>
        <Note><![CDATA[none]]></Note>
        <Returns><![CDATA[#&#60NumMatrix 234567&#62   ]]></Returns>
        <Expression><![CDATA[ <sc>(define Z #(nummat| 21 25 26 22) )         </sc>]]></Expression>  
        <Note><![CDATA[none]]></Note> 
        <Returns><![CDATA[#&#60NumMatrix 345678&#62   ]]></Returns>
        <Expression><![CDATA[ <sc>(setq W (append X Y Z ))      </sc>]]></Expression>  
        <Note><![CDATA[none]]></Note> 
        <Returns><![CDATA[#&#60NumMatrix 456789&#62   ]]></Returns>
        <Expression><![CDATA[ <sc>(display #&#60NumMatrix 456789&#62 )       </sc>]]></Expression>
        <Note><![CDATA[Use the display command to display the contents of the appended Matrix. Note
              that Matrix X, Y and Z are not modified. ]]></Note>
        <Returns><![CDATA[#(nummat| 3.0 5.0 3.0 2.0 1.0 12.0 14.0 15.0 21.0 25.0 26.0 22.0 )]]></Returns>
        <Hints><![CDATA[none]]></Hints>
   </Syntax>
</Example>
