<?xml version="1.0" encoding="ISO-8859-1" standalone="no"?>
<!DOCTYPE Example SYSTEM "../DTD/Example.dtd">
<Example>
	<KnowledgeBase>
		<Title>Example ShortVector isType 018</Title>
		<Template>Example</Template>
		<FunctionKeywords>isType</FunctionKeywords>
		<TypeKeywords>IntVector Boolean String </TypeKeywords>
		<RelatedFunctions>  isObject isText isIntegerVector isBitVector 


                          isNumberVector isByteVector isIdentical isFloatVector


                           isObjectVector isPcodeVector isVector</RelatedFunctions>
		<Language>Lisp</Language>
		<HumanKeywords>Type Analytic Object</HumanKeywords>
	</KnowledgeBase>
	<Description><![CDATA[
                  The <b>isType</b> function is used to check if the argument object is









                  of the correct type.







                  If it is,  the function returns true, otherwise, it returns false.







 










	]]></Description>
	<Syntax>
        <Expression><![CDATA[ <sc>(setq Y (new Vector:  short:  2  11 12) )           </sc>]]></Expression>
        <Note><![CDATA[A Short Vector is defined.]]></Note>
        <Returns><![CDATA[#&#60ShortVector 123456&#62]]></Returns>
        <Expression><![CDATA[ <sc>(isType  ShortVector: Y)      </sc>]]></Expression>
        <Note><![CDATA[none ]]></Note>
        <Returns><![CDATA[ true ]]></Returns>
        <Hints><![CDATA[none]]></Hints>
   </Syntax>
</Example>
