<?xml version="1.0" encoding="ISO-8859-1" standalone="no"?>
<!DOCTYPE Example SYSTEM "../DTD/Example.dtd">
<Example>
	<KnowledgeBase>
		<Title>Example String substringCiGE 001</Title>
		<Template>Example</Template>
		<FunctionKeywords>substringCiGE</FunctionKeywords>
		<TypeKeywords>String Integer</TypeKeywords>
		<RelatedFunctions>substringCiEQ substringCiNE substringCiGT substringCiLT substringCiLE</RelatedFunctions>
		<Language>Lisp</Language>
		<HumanKeywords>compare string equal boolean case-insensitive substring greater</HumanKeywords>
	</KnowledgeBase>
	<Description><![CDATA[ These examples use the <b>substringCiGE</b> function to see if the first substring is
                  greater than or equal to the second substring and return
the Boolean value, true or false. In these examples, a case-insensitive comparison

                  is done with the substrings.

	]]></Description>
	<Syntax>
  	    <Expression><![CDATA[ <sc> (define X "Central Park")  </sc>]]></Expression>
        <Note><![CDATA[none]]></Note>
        <Returns><![CDATA[Central Park ]]></Returns>
        <Expression><![CDATA[ <sc> (define Y "Jurassic Park")  </sc>]]></Expression>  
        <Note><![CDATA[none]]></Note> 
        <Returns><![CDATA[Jurassic Park ]]></Returns>
        <Expression><![CDATA[ <sc>(substringCiGE  X 0 6 Y 0 8)   </sc>]]></Expression>  
        <Note><![CDATA[Compares  "Central" in X and "Jurrasic" in Y .  ]]></Note> 
        <Returns><![CDATA[false]]></Returns>
        <Hints><![CDATA[none]]></Hints>
   </Syntax>
</Example>
